[
  {
    "question_id": "DA_006",
    "question_text": "Hàm COALESCE và NULLIF trong SQL hoạt động như thế nào?",
    "roles": {
      "primary": "DA",
      "secondary": ["DE"]
    },
    "difficulty_label": "EASY",
    "difficulty_score": 2,
    "question_type": "THEORY",
    "skill_tags": [
      "SQL_FUNDAMENTALS",
      "SQL_CTE"
    ],
    "answers": {
      "detailed": "COALESCE trả về giá trị không NULL đầu tiên trong danh sách các đối số. NULLIF so sánh hai biểu thức, trả về NULL nếu chúng bằng nhau, ngược lại trả về biểu thức đầu tiên.",
      "evaluation_points": [
        "COALESCE trả về giá trị non-NULL đầu tiên",
        "NULLIF trả về NULL khi hai biểu thức bằng nhau",
        "Ứng dụng xử lý dữ liệu thiếu trong SQL"
      ]
    },
    "metadata": {
      "language": "vi",
      "source": "manual_expert",
      "version": "v2.0",
      "created_at": "2025-05-09"
    }
  },
  {
    "question_id": "DA_007",
    "question_text": "Khi nào bạn sẽ sử dụng Self Join? Nêu một ví dụ thực tế.",
    "roles": {
      "primary": "DA",
      "secondary": ["DE"]
    },
    "difficulty_label": "MEDIUM",
    "difficulty_score": 4,
    "question_type": "THEORY",
    "skill_tags": [
      "SQL_JOIN",
      "SQL_FUNDAMENTALS"
    ],
    "answers": {
      "detailed": "Self Join dùng để kết nối một bảng với chính nó. Ví dụ điển hình: Trong bảng Employees có cột employee_id và manager_id (trỏ về employee_id), dùng Self Join để lấy tên nhân viên và tên quản lý tương ứng.",
      "evaluation_points": [
        "Self Join kết nối bảng với chính nó",
        "Ứng dụng mô hình quản lý - nhân viên (hierarchical data)",
        "Cú pháp sử dụng alias cho cùng một bảng"
      ]
    },
    "metadata": {
      "language": "vi",
      "source": "manual_expert",
      "version": "v2.0",
      "created_at": "2025-05-09"
    }
  },
  {
    "question_id": "DA_008",
    "question_text": "Toán tử EXISTS và IN khác nhau như thế nào về mặt hiệu năng?",
    "roles": {
      "primary": "DA",
      "secondary": ["DE"]
    },
    "difficulty_label": "MEDIUM",
    "difficulty_score": 5,
    "question_type": "THEORY",
    "skill_tags": [
      "SQL_FUNDAMENTALS",
      "SQL_PERFORMANCE"
    ],
    "answers": {
      "detailed": "EXISTS dừng quét ngay khi tìm thấy bản ghi khớp đầu tiên (Short-circuit), rất tối ưu khi bảng subquery lớn. IN sẽ lấy toàn bộ kết quả của subquery rồi mới so sánh, dễ gây chậm nếu danh sách IN quá dài.",
      "evaluation_points": [
        "EXISTS: Short-circuit evaluation",
        "IN: Phải load toàn bộ kết quả subquery",
        "Chiến lược chọn EXISTS vs IN dựa trên kích thước dataset"
      ]
    },
    "metadata": {
      "language": "vi",
      "source": "manual_expert",
      "version": "v2.0",
      "created_at": "2025-05-09"
    }
  },
  {
    "question_id": "DA_009",
    "question_text": "Phân biệt hàm loc và iloc trong thư viện Pandas.",
    "roles": {
      "primary": "DA",
      "secondary": []
    },
    "difficulty_label": "EASY",
    "difficulty_score": 2,
    "question_type": "CODING",
    "skill_tags": [
      "PYTHON_PANDAS",
      "DATA_PREPROCESSING"
    ],
    "answers": {
      "detailed": "loc dùng để truy xuất dữ liệu dựa trên nhãn (label/index name) của dòng và cột. iloc dùng để truy xuất dữ liệu dựa trên vị trí số nguyên (integer position) từ 0 đến n.",
      "evaluation_points": [
        "loc: label-based indexing",
        "iloc: integer position-based indexing",
        "Hiểu sự khác biệt khi index không phải số nguyên liên tục"
      ]
    },
    "metadata": {
      "language": "vi",
      "source": "kaggle_curated",
      "version": "v2.0",
      "created_at": "2025-05-09"
    }
  },
  {
    "question_id": "DA_010",
    "question_text": "Sự khác biệt giữa hàm groupby() và pivot_table() trong Pandas?",
    "roles": {
      "primary": "DA",
      "secondary": []
    },
    "difficulty_label": "MEDIUM",
    "difficulty_score": 4,
    "question_type": "CODING",
    "skill_tags": [
      "PYTHON_PANDAS",
      "SQL_AGGREGATION"
    ],
    "answers": {
      "detailed": "groupby() gom nhóm dữ liệu theo chiều dọc (trả về MultiIndex Series/DataFrame). pivot_table() có thể gom theo cả dòng và cột (index và columns), tạo ra bảng dạng ma trận 2 chiều trực quan hơn.",
      "evaluation_points": [
        "groupby(): gom nhóm theo chiều dọc (MultiIndex)",
        "pivot_table(): ma trận 2 chiều (index × columns)",
        "Khi nào chọn pivot_table thay vì groupby"
      ]
    },
    "metadata": {
      "language": "vi",
      "source": "kaggle_curated",
      "version": "v2.0",
      "created_at": "2025-05-09"
    }
  },
  {
    "question_id": "DA_011",
    "question_text": "Nêu các mức độ chuẩn hóa cơ sở dữ liệu (Normalization: 1NF, 2NF, 3NF).",
    "roles": {
      "primary": "DA",
      "secondary": ["DE"]
    },
    "difficulty_label": "MEDIUM",
    "difficulty_score": 5,
    "question_type": "THEORY",
    "skill_tags": [
      "DATABASE_DESIGN",
      "DB_ACID"
    ],
    "answers": {
      "detailed": "1NF: Không có cột đa trị. 2NF: Đạt 1NF và các thuộc tính không khóa phải phụ thuộc hoàn toàn vào khóa chính. 3NF: Đạt 2NF và không có sự phụ thuộc bắc cầu giữa các thuộc tính không khóa.",
      "evaluation_points": [
        "1NF: Loại bỏ cột đa trị (Atomic values)",
        "2NF: Phụ thuộc hoàn toàn vào khóa chính (No partial dependency)",
        "3NF: Không có phụ thuộc bắc cầu (No transitive dependency)"
      ]
    },
    "metadata": {
      "language": "vi",
      "source": "manual_expert",
      "version": "v2.0",
      "created_at": "2025-05-09"
    }
  },
  {
    "question_id": "DA_012",
    "question_text": "Nghịch lý Simpson (Simpson's Paradox) là gì?",
    "roles": {
      "primary": "DA",
      "secondary": ["DS"]
    },
    "difficulty_label": "HARD",
    "difficulty_score": 7,
    "question_type": "THEORY",
    "skill_tags": [
      "STAT_FUNDAMENTALS",
      "STAT_DESCRIPTIVE"
    ],
    "answers": {
      "detailed": "Là hiện tượng một xu hướng xuất hiện rõ ràng trong các nhóm dữ liệu nhỏ lẻ, nhưng lại biến mất hoặc đảo ngược hoàn toàn khi các nhóm này được gộp chung lại với nhau.",
      "evaluation_points": [
        "Xu hướng đảo ngược khi gộp nhóm (Reversal effect)",
        "Nguyên nhân: Confounding variable ẩn",
        "Cách phòng tránh: Phân tầng dữ liệu trước khi kết luận"
      ]
    },
    "metadata": {
      "language": "vi",
      "source": "manual_expert",
      "version": "v2.0",
      "created_at": "2025-05-09"
    }
  },
  {
    "question_id": "DA_013",
    "question_text": "Sự khác biệt giữa Z-test và T-test trong thống kê là gì?",
    "roles": {
      "primary": "DA",
      "secondary": ["DS"]
    },
    "difficulty_label": "MEDIUM",
    "difficulty_score": 5,
    "question_type": "THEORY",
    "skill_tags": [
      "STAT_AB_TESTING",
      "STAT_HYPOTHESIS_TESTING"
    ],
    "answers": {
      "detailed": "Cả hai đều dùng để kiểm định giả thuyết về giá trị trung bình. Z-test dùng khi cỡ mẫu lớn (n > 30) và ĐÃ BIẾT phương sai tổng thể. T-test dùng khi cỡ mẫu nhỏ và CHƯA BIẾT phương sai tổng thể.",
      "evaluation_points": [
        "Z-test: cỡ mẫu lớn, phương sai tổng thể đã biết",
        "T-test: cỡ mẫu nhỏ, phương sai tổng thể chưa biết",
        "Khi n → ∞, phân phối t tiến gần đến phân phối z"
      ]
    },
    "metadata": {
      "language": "vi",
      "source": "manual_expert",
      "version": "v2.0",
      "created_at": "2025-05-09"
    }
  },
  {
    "question_id": "DA_014",
    "question_text": "Khoảng tin cậy (Confidence Interval) 95% có ý nghĩa gì?",
    "roles": {
      "primary": "DA",
      "secondary": ["DS"]
    },
    "difficulty_label": "MEDIUM",
    "difficulty_score": 5,
    "question_type": "THEORY",
    "skill_tags": [
      "STAT_FUNDAMENTALS",
      "STAT_CONFIDENCE_INTERVAL"
    ],
    "answers": {
      "detailed": "Nghĩa là nếu ta thực hiện lấy mẫu và tính toán khoảng tin cậy 100 lần, thì sẽ có khoảng 95 lần giá trị thực sự (true parameter) của tổng thể nằm trong các khoảng tin cậy vừa tính được.",
      "evaluation_points": [
        "Định nghĩa: Tỷ lệ bao phủ parameter thực (Coverage probability)",
        "Sai lầm phổ biến: CI 95% KHÔNG phải là xác suất 1 tham số nằm trong khoảng",
        "Mối liên hệ với Point Estimate và Margin of Error"
      ]
    },
    "metadata": {
      "language": "vi",
      "source": "manual_expert",
      "version": "v2.0",
      "created_at": "2025-05-09"
    }
  },
  {
    "question_id": "DA_015",
    "question_text": "Cohort Analysis (Phân tích thuần tập) là gì và ứng dụng để làm gì?",
    "roles": {
      "primary": "DA",
      "secondary": []
    },
    "difficulty_label": "MEDIUM",
    "difficulty_score": 4,
    "question_type": "THEORY",
    "skill_tags": [
      "ANALYTICS_COHORT",
      "STAT_DESCRIPTIVE"
    ],
    "answers": {
      "detailed": "Là việc chia người dùng thành các nhóm có chung một đặc điểm trong một khoảng thời gian (VD: User đăng ký vào tháng 1). Ứng dụng để theo dõi tỷ lệ giữ chân (Retention Rate) thay đổi thế nào qua thời gian.",
      "evaluation_points": [
        "Cohort: Nhóm người dùng có chung đặc điểm trong khung thời gian",
        "Ứng dụng chính: Theo dõi Retention Rate",
        "Phân biệt Cohort Analysis và Segmentation"
      ]
    },
    "metadata": {
      "language": "vi",
      "source": "manual_expert",
      "version": "v2.0",
      "created_at": "2025-05-09"
    }
  },
  {
    "question_id": "DA_016",
    "question_text": "Mô hình RFM trong phân tích khách hàng là viết tắt của gì?",
    "roles": {
      "primary": "DA",
      "secondary": []
    },
    "difficulty_label": "EASY",
    "difficulty_score": 3,
    "question_type": "THEORY",
    "skill_tags": [
      "ANALYTICS_RFM",
      "ANALYTICS_BUSINESS"
    ],
    "answers": {
      "detailed": "Recency (Lần mua hàng gần nhất), Frequency (Tần suất mua hàng), và Monetary (Tổng tiền chi tiêu). Dùng để phân khúc khách hàng (VIP, Dễ rời bỏ, Khách hàng mới).",
      "evaluation_points": [